{
  "schema_version": 1,
  "id": "four-against-the-abyss",
  "title": "Four Against the Abyss",
  "kind": "rules_expansion",
  "status": "active",
  "locked": false,
  "enabled_by_default": false,
  "source": {
    "type": "pdf",
    "source_pdf": "Four-Against-the-Abyss.pdf"
  },
  "capabilities": [
    "foes",
    "items",
    "tables",
    "states",
    "rules",
    "campaign_state",
    "procedures"
  ],
  "content_sources": [
    {"kind": "tables", "path": "data/rules/abyss_tables.json", "description": "Abyss room, foe, trap, treasure, and reward tables."},
    {"kind": "foes", "path": "data/rules/abyss_tables.json", "description": "Abyss foes are encounter-table rows rather than a standalone bestiary file."},
    {"kind": "items", "path": "data/rules/abyss_tables.json", "description": "Named Abyss item rewards remain table-backed."}
  ],
  "dependencies": ["expanded-edition-core"],
  "conflicts": [],
  "legacy_mappings": {
    "ruleset_profile_id": ["abyss"]
  },
  "notes": "Abyss-specific tables, afflictions, items, and campaign-state behavior remain wired through existing modules."
}
