{
  "schema_version": 1,
  "id": "courtship",
  "title": "The Courtship of Flower Demons",
  "kind": "rules_expansion",
  "status": "active",
  "locked": false,
  "enabled_by_default": false,
  "source": {
    "type": "pdf",
    "source_pdf": "The_Courtship_of_Flower_Demons.pdf"
  },
  "capabilities": [
    "foes",
    "classes",
    "items",
    "tables",
    "states",
    "rules",
    "terrain_types",
    "locations",
    "procedures"
  ],
  "content_sources": [
    {"kind": "tables", "path": "data/rules/courtship_tables.json", "description": "Courtship encounter and procedure tables."},
    {"kind": "tables", "path": "data/rules/courtship_blossoms_tables.json", "description": "Blossoms magic, scroll, and Lex tables."},
    {"kind": "foes", "path": "data/rules/courtship_monsters.json", "description": "Courtship structured bestiary groups."},
    {"kind": "classes", "path": "data/rules/classes.json", "description": "Courtship class records; ownership is declared in ruleset_profiles.json."},
    {"kind": "items", "path": "data/rules/courtship_blossoms_tables.json", "description": "Courtship named table-backed item rewards."}
  ],
  "dependencies": ["expanded-edition-core"],
  "conflicts": [],
  "legacy_mappings": {
    "courtship_enabled": ["true"],
    "ruleset_profile_id": ["forsaken_depths"]
  },
  "notes": "Courtship content is currently enabled through the Forsaken Depths profile switch."
}
